{
  "id": "01KGQP2PRTVDAZQQF21CESWD1P",
  "projectId": "astroduck_demo",
  "type": "generate",
  "status": "queued",
  "createdAt": "2026-02-05T19:57:15.418Z",
  "updatedAt": "2026-02-05T19:57:15.418Z",
  "input": {
    "specId": "spec_astroduck_boss3_solar_entity_seq",
    "templateId": "txt2img",
    "checkpointName": "copaxTimeless_xivSDXL.safetensors",
    "sequenceId": "01KGQP2PR60PBQK1B9W82HYCRK",
    "assetId": "01KGQP2PR60PBQK1B9W82HYCRK",
    "frameIndex": 7,
    "frameCount": 12,
    "frameName": "frame_08",
    "framePrompt": "charge, flare buildup",
    "positive": "sci-fi comic, bold outlines, high contrast, clean shapes, Boss 3 solar entity sprite, gigantic fiery alien, corona flames, bright core, bold comic shading, transparent background, idle + attack frames consistent, charge, flare buildup"
  }
}
