{
  "id": "01KGQP2Q2Z4PXAF2N23MYMK4Z1",
  "projectId": "astroduck_demo",
  "type": "generate",
  "status": "queued",
  "createdAt": "2026-02-05T19:57:15.743Z",
  "updatedAt": "2026-02-05T19:57:15.743Z",
  "input": {
    "specId": "spec_astroduck_menu_button_difficulty_default",
    "templateId": "txt2img",
    "checkpointName": "copaxTimeless_xivSDXL.safetensors"
  }
}
