{
  "id": "01KGQP2PT76KAAFK1R8F3X5SRD",
  "projectId": "astroduck_demo",
  "type": "generate",
  "status": "queued",
  "createdAt": "2026-02-05T19:57:15.464Z",
  "updatedAt": "2026-02-05T19:57:15.464Z",
  "input": {
    "specId": "spec_astroduck_enemy_fighter_seq",
    "templateId": "txt2img",
    "checkpointName": "copaxTimeless_xivSDXL.safetensors",
    "sequenceId": "01KGQP2PSSYMJCYZ30YNMSEWEP",
    "assetId": "01KGQP2PSSYMJCYZ30YNMSEWEP",
    "frameIndex": 5,
    "frameCount": 6,
    "frameName": "frame_06",
    "framePrompt": "idle fly, return to level",
    "positive": "sci-fi comic, bold outlines, high contrast, clean shapes, Enemy fighter sprite, sleek alien ship, red/purple highlights, bold comic outlines, clean silhouette, transparent background, idle loop consistency, idle fly, return to level"
  }
}
