{
  "id": "01KGQP2PQAYG3G42MHD0WYQV6F",
  "projectId": "astroduck_demo",
  "type": "generate",
  "status": "queued",
  "createdAt": "2026-02-05T19:57:15.370Z",
  "updatedAt": "2026-02-05T19:57:15.370Z",
  "input": {
    "specId": "spec_astroduck_boss2_drilling_core_seq",
    "templateId": "txt2img",
    "checkpointName": "copaxTimeless_xivSDXL.safetensors",
    "sequenceId": "01KGQP2PQ8SMD5R5S6CK9ENP51",
    "assetId": "01KGQP2PQ8SMD5R5S6CK9ENP51",
    "frameIndex": 0,
    "frameCount": 10,
    "frameName": "frame_01",
    "framePrompt": "idle, drill core dormant, faint glow",
    "positive": "sci-fi comic, bold outlines, high contrast, clean shapes, Boss 2 drilling core sprite, massive industrial drill, molten glow, Mars dust accents, bold comic style, transparent background, idle + attack frames consistent, idle, drill core dormant, faint glow"
  }
}
