{
  "id": "01KGQP2PZAWHV65KBY7D979T35",
  "projectId": "astroduck_demo",
  "type": "generate",
  "status": "queued",
  "createdAt": "2026-02-05T19:57:15.626Z",
  "updatedAt": "2026-02-05T19:57:15.626Z",
  "input": {
    "specId": "spec_astroduck_player_thruster_vfx_seq",
    "templateId": "txt2img",
    "checkpointName": "copaxTimeless_xivSDXL.safetensors",
    "sequenceId": "01KGQP2PYP4ZVX8YY0ZS9D8WAM",
    "assetId": "01KGQP2PYP4ZVX8YY0ZS9D8WAM",
    "frameIndex": 7,
    "frameCount": 8,
    "frameName": "frame_08",
    "framePrompt": "flame medium, steady",
    "positive": "sci-fi comic, bold outlines, high contrast, clean shapes, Player thruster flame VFX, blue/orange jet with glow, stylized comic flames, loopable frames, transparent background, flame medium, steady"
  }
}
