{
  "id": "01KGQP2PWFSGG93N4CWYPJ6RK3",
  "projectId": "astroduck_demo",
  "type": "generate",
  "status": "queued",
  "createdAt": "2026-02-05T19:57:15.536Z",
  "updatedAt": "2026-02-05T19:57:15.536Z",
  "input": {
    "specId": "spec_astroduck_impact_sparks_seq",
    "templateId": "txt2img",
    "checkpointName": "copaxTimeless_xivSDXL.safetensors",
    "sequenceId": "01KGQP2PWE3KJ7A7EJ8FWFY39T",
    "assetId": "01KGQP2PWE3KJ7A7EJ8FWFY39T",
    "frameIndex": 0,
    "frameCount": 8,
    "frameName": "frame_01",
    "framePrompt": "small impact, sharp spark",
    "positive": "sci-fi comic, bold outlines, high contrast, clean shapes, Impact sparks VFX, small and large bursts, angular shards, bright yellow/white cores, loopable frames, transparent background, small impact, sharp spark"
  }
}
