{
  "id": "01KGQP2PTH1AZ7FMAVPSPVVMQ9",
  "projectId": "astroduck_demo",
  "type": "generate",
  "status": "queued",
  "createdAt": "2026-02-05T19:57:15.473Z",
  "updatedAt": "2026-02-05T19:57:15.473Z",
  "input": {
    "specId": "spec_astroduck_enemy_turret_seq",
    "templateId": "txt2img",
    "checkpointName": "copaxTimeless_xivSDXL.safetensors",
    "sequenceId": "01KGQP2PT9EGQ419YANJRXHWB3",
    "assetId": "01KGQP2PT9EGQ419YANJRXHWB3",
    "frameIndex": 2,
    "frameCount": 8,
    "frameName": "frame_03",
    "framePrompt": "idle, turret scanning right",
    "positive": "sci-fi comic, bold outlines, high contrast, clean shapes, Enemy ground turret sprite, chunky sci-fi cannon, glowing muzzle, comic shading, transparent background, idle + shoot frames consistent, idle, turret scanning right"
  }
}
