{
  "id": "01KGQP2PYDXQCDWZJH03YSHGSG",
  "projectId": "astroduck_demo",
  "type": "generate",
  "status": "queued",
  "createdAt": "2026-02-05T19:57:15.597Z",
  "updatedAt": "2026-02-05T19:57:15.597Z",
  "input": {
    "specId": "spec_astroduck_player_ship_seq",
    "templateId": "txt2img",
    "checkpointName": "copaxTimeless_xivSDXL.safetensors",
    "sequenceId": "01KGQP2PY8NJNCYEG93D38QQ1S",
    "assetId": "01KGQP2PY8NJNCYEG93D38QQ1S",
    "frameIndex": 2,
    "frameCount": 6,
    "frameName": "frame_03",
    "framePrompt": "idle, centered, subtle sway",
    "positive": "sci-fi comic, bold outlines, high contrast, clean shapes, AstroDuck piloting a compact sci-fi ship, duck-beak nosecone, teal/orange cockpit glow, bold comic outlines, clean silhouette, consistent lighting, transparent background, animation frames consistent, idle, centered, subtle sway"
  }
}
