{
  "id": "01KGQP2Q45JRW9T136VXGW0VJZ",
  "projectId": "astroduck_demo",
  "type": "generate",
  "status": "queued",
  "createdAt": "2026-02-05T19:57:15.781Z",
  "updatedAt": "2026-02-05T19:57:15.781Z",
  "input": {
    "specId": "spec_astroduck_space_nova_texture",
    "templateId": "txt2img",
    "checkpointName": "copaxTimeless_xivSDXL.safetensors"
  }
}
