{
  "id": "01KGQP2Q08CQVG0NRNB62EHHPW",
  "projectId": "astroduck_demo",
  "type": "generate",
  "status": "queued",
  "createdAt": "2026-02-05T19:57:15.656Z",
  "updatedAt": "2026-02-05T19:57:15.656Z",
  "input": {
    "specId": "spec_astroduck_warp_effect_seq",
    "templateId": "txt2img",
    "checkpointName": "copaxTimeless_xivSDXL.safetensors",
    "sequenceId": "01KGQP2PZYY5QKJJAFF3439MET",
    "assetId": "01KGQP2PZYY5QKJJAFF3439MET",
    "frameIndex": 4,
    "frameCount": 12,
    "frameName": "frame_05",
    "framePrompt": "warp peak, tunnel effect",
    "positive": "sci-fi comic, bold outlines, high contrast, clean shapes, Warp transition VFX, swirling tunnel with bright core, streaking stars, smooth gradients, loopable frames, transparent background, warp peak, tunnel effect"
  }
}
