{
  "id": "01KGQP2PVXR3RHYXV34RZNZB4Y",
  "projectId": "astroduck_demo",
  "type": "generate",
  "status": "queued",
  "createdAt": "2026-02-05T19:57:15.517Z",
  "updatedAt": "2026-02-05T19:57:15.517Z",
  "input": {
    "specId": "spec_astroduck_impact_seq",
    "templateId": "txt2img",
    "checkpointName": "copaxTimeless_xivSDXL.safetensors",
    "sequenceId": "01KGQP2PVT56F44V0DEP6TDYH6",
    "assetId": "01KGQP2PVT56F44V0DEP6TDYH6",
    "frameIndex": 1,
    "frameCount": 8,
    "frameName": "frame_02",
    "framePrompt": "impact burst, expanding sparks",
    "positive": "sci-fi comic, bold outlines, high contrast, clean shapes, large impact sparks, wide burst with shards, transparent background, loopable frames, impact burst, expanding sparks"
  }
}
