{
  "id": "01KGQP2Q3RJJMFPNYNJD2D77A3",
  "projectId": "astroduck_demo",
  "type": "generate",
  "status": "queued",
  "createdAt": "2026-02-05T19:57:15.768Z",
  "updatedAt": "2026-02-05T19:57:15.768Z",
  "input": {
    "specId": "spec_astroduck_menu_button_start_hover",
    "templateId": "txt2img",
    "checkpointName": "copaxTimeless_xivSDXL.safetensors"
  }
}
