{
  "id": "01KGQP2PVRPEXW3RVD2V24YJPB",
  "projectId": "astroduck_demo",
  "type": "generate",
  "status": "queued",
  "createdAt": "2026-02-05T19:57:15.512Z",
  "updatedAt": "2026-02-05T19:57:15.512Z",
  "input": {
    "specId": "spec_astroduck_explosions_vfx_seq",
    "templateId": "txt2img",
    "checkpointName": "copaxTimeless_xivSDXL.safetensors",
    "sequenceId": "01KGQP2PTZNASBWFHZ2RZNYAAH",
    "assetId": "01KGQP2PTZNASBWFHZ2RZNYAAH",
    "frameIndex": 9,
    "frameCount": 10,
    "frameName": "frame_10",
    "framePrompt": "large explosion, fade",
    "positive": "sci-fi comic, bold outlines, high contrast, clean shapes, Small/medium/large explosion sprites, stylized comic burst, bright orange/yellow, thick outlines, multi-frame loop, transparent background, large explosion, fade"
  }
}
