{
  "id": "01KGQP2PRA4QH84GZA6KDT5MGQ",
  "projectId": "astroduck_demo",
  "type": "generate",
  "status": "queued",
  "createdAt": "2026-02-05T19:57:15.402Z",
  "updatedAt": "2026-02-05T19:57:15.402Z",
  "input": {
    "specId": "spec_astroduck_boss3_solar_entity_seq",
    "templateId": "txt2img",
    "checkpointName": "copaxTimeless_xivSDXL.safetensors",
    "sequenceId": "01KGQP2PR60PBQK1B9W82HYCRK",
    "assetId": "01KGQP2PR60PBQK1B9W82HYCRK",
    "frameIndex": 1,
    "frameCount": 12,
    "frameName": "frame_02",
    "framePrompt": "idle, glow intensifies slightly",
    "positive": "sci-fi comic, bold outlines, high contrast, clean shapes, Boss 3 solar entity sprite, gigantic fiery alien, corona flames, bright core, bold comic shading, transparent background, idle + attack frames consistent, idle, glow intensifies slightly"
  }
}
