{
  "id": "01KGQP2Q32WT2D3S34KQFM9NFN",
  "projectId": "astroduck_demo",
  "type": "generate",
  "status": "queued",
  "createdAt": "2026-02-05T19:57:15.746Z",
  "updatedAt": "2026-02-05T19:57:15.746Z",
  "input": {
    "specId": "spec_astroduck_menu_button_difficulty_hover",
    "templateId": "txt2img",
    "checkpointName": "copaxTimeless_xivSDXL.safetensors"
  }
}
