{
  "id": "01KGQP2Q2ESW4TW51ENSGT53RJ",
  "projectId": "astroduck_demo",
  "type": "generate",
  "status": "queued",
  "createdAt": "2026-02-05T19:57:15.726Z",
  "updatedAt": "2026-02-05T19:57:15.726Z",
  "input": {
    "specId": "spec_astroduck_level_select_earth_locked",
    "templateId": "txt2img",
    "checkpointName": "copaxTimeless_xivSDXL.safetensors"
  }
}
