{
  "id": "01KGQP2Q34G2Q43BM6JHE6XCC9",
  "projectId": "astroduck_demo",
  "type": "generate",
  "status": "queued",
  "createdAt": "2026-02-05T19:57:15.748Z",
  "updatedAt": "2026-02-05T19:57:15.748Z",
  "input": {
    "specId": "spec_astroduck_menu_button_difficulty_pressed",
    "templateId": "txt2img",
    "checkpointName": "copaxTimeless_xivSDXL.safetensors"
  }
}
