{
  "id": "01KGQP2Q0XSDCNH4FRPS8VT4FF",
  "projectId": "astroduck_demo",
  "type": "generate",
  "status": "queued",
  "createdAt": "2026-02-05T19:57:15.677Z",
  "updatedAt": "2026-02-05T19:57:15.677Z",
  "input": {
    "specId": "spec_astroduck_weapon_muzzle_flashes_seq",
    "templateId": "txt2img",
    "checkpointName": "copaxTimeless_xivSDXL.safetensors",
    "sequenceId": "01KGQP2Q0WJWTB9V9V96VQJBG2",
    "assetId": "01KGQP2Q0WJWTB9V9V96VQJBG2",
    "frameIndex": 0,
    "frameCount": 6,
    "frameName": "frame_01",
    "framePrompt": "laser muzzle flash, thin bright line",
    "positive": "sci-fi comic, bold outlines, high contrast, clean shapes, Weapon muzzle flashes set, short burst shapes with bright core and glow, additive look, 4-6 frame loops, transparent background, laser muzzle flash, thin bright line"
  }
}
