{
  "id": "01KGQP2PXERJX9DKZ52BZDS378",
  "projectId": "astroduck_demo",
  "type": "generate",
  "status": "queued",
  "createdAt": "2026-02-05T19:57:15.566Z",
  "updatedAt": "2026-02-05T19:57:15.566Z",
  "input": {
    "specId": "spec_astroduck_muzzle_flash_seq",
    "templateId": "txt2img",
    "checkpointName": "copaxTimeless_xivSDXL.safetensors",
    "sequenceId": "01KGQP2PX3XGYK7HFKA220KVB7",
    "assetId": "01KGQP2PX3XGYK7HFKA220KVB7",
    "frameIndex": 4,
    "frameCount": 6,
    "frameName": "frame_05",
    "framePrompt": "flash fade, ember",
    "positive": "sci-fi comic, bold outlines, high contrast, clean shapes, spread muzzle flash, short wide burst, transparent background, loopable frames, flash fade, ember"
  }
}
